### ISSUE TITLE
Using Multipath TCP on recent Linux kernels

### ISSUE THREAD

**Issue by BurlyLuo** [mptcp-apps/mptcp-doc#1]
```
root@rowan> 3-mptcp-apps]# ./1-setup-clab.sh 

for br in br0; do
    ip l s $br down > /dev/null 2>&1
    ip l d $br
    ip l a $br type bridge
    ip l s $br up
done
Cannot find device "br0"

cat <<EOF>clab.yaml | clab deploy -t clab.yaml -
name: mptcp
topology:
  nodes:
    br0:
      kind: bridge

    gw:
      kind: linux
      image: 192.168.2.100:5000/ucni
      exec:
      - ip addr add 10.1.5.1/24 dev net1
      - iptables -t nat -A POSTROUTING -s 10.1.0.0/16 -o eth0 -j MASQUERADE

    client:
      kind: linux
      image: 192.168.2.100:5000/ucni
      exec:
      - ip addr add 10.1.5.10/24 dev net1
      - ip addr add 10.1.5.11/24 dev net2

      - ip route add default via 10.1.5.1 dev net1 metric 100
      - ip route add default via 10.1.5.1 dev net2 metric 200

      - ip rule add from 10.1.5.10 table 1
      - ip rule add from 10.1.5.11 table 2 

      - ip r a 10.1.5.0/24 dev net1 scope link table 1
      - ip r a default via 10.1.5.1 dev net1 table 1

      - ip r a 10.1.5.0/24 dev net2 scope link table 2
      - ip r a default via 10.1.5.1 dev net2 table 2 
 
      - ip r r default scope global nexthop via 10.1.5.1 dev net1

      - ip mptcp endpoint add 10.1.5.10 id 10 dev net1
      - ip mptcp endpoint add 10.1.5.11 id 11 dev net2 signal
      
  links:
    - endpoints: ["br0:net1", "client:net1"]
    - endpoints: ["br0:net2", "client:net2"]
    - endpoints: ["gw:net1", "br0:net3"]
EOF
INFO[0000] Containerlab v0.59.0 started                 
INFO[0000] Parsing & checking topology file: clab.yaml  
INFO[0000] Creating docker network: Name="clab", IPv4Subnet="172.20.20.0/24", IPv6Subnet="3fff:172:20:20::/64", MTU=1500 
INFO[0000] Creating lab directory: /root/wcni-kind/LabasCode/netenv/4-adv-network/57-MPTCP/3-mptcp-apps/clab-mptcp 
INFO[0000] Creating container: "gw"                     
INFO[0000] Creating container: "client"                 
INFO[0002] Created link: gw:net1 <--> br0:net3          
INFO[0002] Created link: br0:net1 <--> client:net1      
INFO[0002] Created link: br0:net2 <--> client:net2      
INFO[0018] Executed command "ip addr add 10.1.5.1/24 dev net1" on the node "gw". stdout: 
INFO[0018] Executed command "iptables -t nat -A POSTROUTING -s 10.1.0.0/16 -o eth0 -j MASQUERADE" on the node "gw". stdout: 
INFO[0018] Executed command "ip addr add 10.1.5.10/24 dev net1" on the node "client". stdout: 
INFO[0018] Executed command "ip addr add 10.1.5.11/24 dev net2" on the node "client". stdout: 
INFO[0018] Executed command "ip route add default via 10.1.5.1 dev net1 metric 100" on the node "client". stdout: 
INFO[0018] Executed command "ip route add default via 10.1.5.1 dev net2 metric 200" on the node "client". stdout: 
INFO[0018] Executed command "ip rule add from 10.1.5.10 table 1" on the node "client". stdout: 
INFO[0018] Executed command "ip rule add from 10.1.5.11 table 2" on the node "client". stdout: 
INFO[0018] Executed command "ip r a 10.1.5.0/24 dev net1 scope link table 1" on the node "client". stdout: 
INFO[0018] Executed command "ip r a default via 10.1.5.1 dev net1 table 1" on the node "client". stdout: 
INFO[0018] Executed command "ip r a 10.1.5.0/24 dev net2 scope link table 2" on the node "client". stdout: 
INFO[0018] Executed command "ip r a default via 10.1.5.1 dev net2 table 2" on the node "client". stdout: 
INFO[0018] Executed command "ip r r default scope global nexthop via 10.1.5.1 dev net1" on the node "client". stdout: 
INFO[0018] Executed command "ip mptcp endpoint add 10.1.5.10 id 10 dev net1" on the node "client". stdout: 
INFO[0018] Executed command "ip mptcp endpoint add 10.1.5.11 id 11 dev net2 signal" on the node "client". stdout: 
INFO[0018] Adding containerlab host entries to /etc/hosts file 
INFO[0018] Adding ssh config for containerlab nodes     
INFO[0018]  New containerlab version 0.67.0 is available! Release notes: https://containerlab.dev/rn/0.67/
Run 'containerlab version upgrade' to upgrade or go check other installation options at https://containerlab.dev/install/ 
+---+-------------------+--------------+-------------------------+-------+---------+----------------+----------------------+
| # |       Name        | Container ID |          Image          | Kind  |  State  |  IPv4 Address  |     IPv6 Address     |
+---+-------------------+--------------+-------------------------+-------+---------+----------------+----------------------+
| 1 | clab-mptcp-client | c290d7e0b858 | 192.168.2.100:5000/ucni | linux | running | 172.20.20.3/24 | 3fff:172:20:20::3/64 |
| 2 | clab-mptcp-gw     | cfa6fceb99d6 | 192.168.2.100:5000/ucni | linux | running | 172.20.20.2/24 | 3fff:172:20:20::2/64 |
+---+-------------------+--------------+-------------------------+-------+---------+----------------+----------------------+
[root@rowan> 3-mptcp-apps]# 
```

but got:
```
client~$ps -ef 
UID          PID    PPID  C STIME TTY          TIME CMD
root           1       0  0 04:22 pts/0    00:00:00 /usr/bin/tini -g -- /entrypoint.sh
root           7       1  0 04:22 pts/0    00:00:00 sh /entrypoint.sh
root          15       7  0 04:22 pts/0    00:00:00 nginx: master process nginx -g daemon off;
www-data      16      15  0 04:22 pts/0    00:00:00 nginx: worker process
root          95       0  0 04:25 pts/1    00:00:00 bash
root         104      95  0 04:25 pts/1    00:00:00 ps -ef
client~$echo -e "GET / HTTP/1.0\r\n" | mptcpize run nc -4 -i 5 test.multipath-tcp.org 80
Ncat: Idle timeout expired (5000 ms).
client~$echo -e "GET / HTTP/1.0\r\n" | mptcpize run nc -4 -i 5 test.multipath-tcp.org 80
HTTP/1.0 500 Internal Server Error
Content-Type: text/html; charset=utf-8
Content-Length: 265
Connection: close
Date: Mon, 21 Apr 2025 04:25:43 GMT
Server: lighttpd/1.4.74

<!doctype html>
<html lang=en>
<title>500 Internal Server Error</title>
<h1>Internal Server Error</h1>
<p>The server encountered an internal error and was unable to complete your request. Either the server is overloaded or there is an error in the application.</p>
Ncat: Idle timeout expired (5000 ms).
client~$ip rule show 
0:      from all lookup local
32764:  from 10.1.5.11 lookup 2
32765:  from 10.1.5.10 lookup 1
32766:  from all lookup main
32767:  from all lookup default
client~$ip r s t 1
default via 10.1.5.1 dev net1 
10.1.5.0/24 dev net1 scope link 
client~$ip r s t 2
default via 10.1.5.1 dev net2 
10.1.5.0/24 dev net2 scope link 
client~$ip r s 
default via 10.1.5.1 dev net1 
default via 10.1.5.1 dev net1 metric 100 
default via 10.1.5.1 dev net2 metric 200 
10.1.5.0/24 dev net1 proto kernel scope link src 10.1.5.10 
10.1.5.0/24 dev net2 proto kernel scope link src 10.1.5.11 
172.20.20.0/24 dev eth0 proto kernel scope link src 172.20.20.3 
client~$ping test.multipath-tcp.org
PING test.multipath-tcp.org (5.196.67.207) 56(84) bytes of data.
64 bytes from ns399285.ip-5-196-67.eu (5.196.67.207): icmp_seq=1 ttl=44 time=297 ms
64 bytes from ns399285.ip-5-196-67.eu (5.196.67.207): icmp_seq=2 ttl=44 time=297 ms
^C
--- test.multipath-tcp.org ping statistics ---
2 packets transmitted, 2 received, 0% packet loss, time 999ms
rtt min/avg/max/mdev = 297.101/297.217/297.334/0.116 ms
client~$
```

**Comment by matttbe** [comment]
Hello,

> ```
> echo -e "GET / HTTP/1.0\r\n" | mptcpize run nc -4 -i 5 test.multipath-tcp.org 80
> ```

Mmh, indeed, this method can no longer work with the current server I think.

Instead, you can use:

     mptcpize run curl https://check.mptcp.dev/ 

Note that MPTCP can still be "blocked" somewhere between your client and the server.


>       - ip rule add from 10.1.5.10 table 1
>       - ip rule add from 10.1.5.11 table 2 
> 
>       - ip r a 10.1.5.0/24 dev net1 scope link table 1
>       - ip r a default via 10.1.5.1 dev net1 table 1
> 
>       - ip r a 10.1.5.0/24 dev net2 scope link table 2
>       - ip r a default via 10.1.5.1 dev net2 table 2

Note that these rules and routes and no longer needed when using `ip mptcp endpoint add (...)` with `dev <interface>`. I see that the doc here should be updated.

For up-to-date documentation, please check https://mptcp.dev

**Comment by BurlyLuo** [comment]
Thanks for your feedback. 
i am confused that if there are 2 path to the destiaton. which  like: https://www.mptcp.dev/setup.html#manual-routing-configuration
A-path: 10.1.5.1
B-path: 10.1.8.1
I think we did need the SBR(source based routing to send the packet to the spec-gw)
pls correct me if i mis-understand the case. thanks

**Comment by BurlyLuo** [comment]
I have made a test:
```
[root@rowan> 3-mptcp-apps]# cat 1-setup-clab.sh 
#!/bin/bash
set -v

for br in br0; do
    ip l s $br down > /dev/null 2>&1
    ip l d $br
    ip l a $br type bridge
    ip l s $br up
done

cat <<EOF>clab.yaml | clab deploy -t clab.yaml -
name: mptcp
topology:
  nodes:
    br0:
      kind: bridge

    gw:
      kind: linux
      image: 192.168.2.100:5000/ucni
      exec:
      - ip addr add 10.1.5.1/24 dev net1
      - ip addr add 10.1.8.1/24 dev net1
      - iptables -t nat -A POSTROUTING -s 10.1.0.0/16 -o eth0 -j MASQUERADE

    client:
      kind: linux
      image: 192.168.2.100:5000/ucni
      exec:
      - ip addr add 10.1.5.10/24 dev net1
      - ip addr add 10.1.8.10/24 dev net2

      - ip rule add from 10.1.5.10 table 5
      - ip rule add from 10.1.8.10 table 8

      - ip r a default via 10.1.5.1 dev net1 table 5

      - ip r a default via 10.1.8.1 dev net2 table 8 

      - ip mptcp endpoint add 10.1.5.10 id 5 dev net1 subflow
      - ip mptcp endpoint add 10.1.8.10 id 8 dev net2 subflow

      # mptcpize run curl https://check.mptcp.dev/
      
  links:
    - endpoints: ["br0:net1", "client:net1"]
    - endpoints: ["br0:net2", "client:net2"]
    - endpoints: ["gw:net1", "br0:net3"]
EOF
```
and capture the pcap:
```
3	2025-04-22 14:11:59.361327	10.1.5.10	5.196.67.207	MPTCP	86	0xe103 (57603)	0	0	1	57337	443	57337 → 443 [SYN] Seq=0 Win=64256 Len=0 MSS=9460 SACK_PERM TSval=1072226218 TSecr=0 WS=128
4	2025-04-22 14:11:59.361788			ARP	42							Who has 10.1.8.1? Tell 10.1.8.10
5	2025-04-22 14:11:59.361811			ARP	42							10.1.8.1 is at aa:c1:ab:4b:20:03
6	2025-04-22 14:11:59.361861	10.1.8.10	5.196.67.207	MPTCP	86	0xba14 (47636)	0	0	1	35933	443	35933 → 443 [SYN] Seq=0 Win=64256 Len=0 MSS=9460 SACK_PERM TSval=2537133921 TSecr=0 WS=128
7	2025-04-22 14:11:59.655292	5.196.67.207	10.1.8.10	MPTCP	90	0x0000 (0)	0	1	1	443	35933	443 → 35933 [SYN, ACK] Seq=0 Ack=1 Win=65160 Len=0 MSS=1460 SACK_PERM TSval=2227082490 TSecr=2537133921 WS=128
8	2025-04-22 14:11:59.655450	10.1.8.10	5.196.67.207	MPTCP	90	0xba15 (47637)	1	1	1	35933	443	35933 → 443 [ACK] Seq=1 Ack=1 Win=64256 Len=0 TSval=2537134214 TSecr=2227082490
9	2025-04-22 14:11:59.669269	5.196.67.207	10.1.5.10	MPTCP	90	0x0000 (0)	0	1	1	443	57337	443 → 57337 [SYN, ACK] Seq=0 Ack=1 Win=65160 Len=0 MSS=1460 SACK_PERM TSval=2227082499 TSecr=1072226218 WS=128
10	2025-04-22 14:11:59.669400	10.1.5.10	5.196.67.207	MPTCP	90	0xe104 (57604)	1	1	1	57337	443	57337 → 443 [ACK] Seq=1 Ack=1 Win=64256 Len=0 TSval=1072226526 TSecr=2227082499
```
and attach the pcap, would you pls help double confirm the pcap is with mptcp or without. thx 

[sbr-mptcp.zip](https://github.com/user-attachments/files/19844265/sbr-mptcp.zip)

**Comment by matttbe** [comment]
> Thanks for your feedback. i am confused that if there are 2 path to the destiaton. which like: https://www.mptcp.dev/setup.html#manual-routing-configuration A-path: 10.1.5.1 B-path: 10.1.8.1 I think we did need the SBR(source based routing to send the packet to the spec-gw) pls correct me if i mis-understand the case. thanks

When you add an MPTCP endpoint with `dev <interface>`, you force the kernel to set both the source IP address and the output interface. By doing that, the routing will take the output interface into consideration, and no need to have to deal with extra routing rules.

You can check yourself, e.g.

```
$ ip route get 1.1.1.1
1.1.1.1 via 192.168.1.1 dev eth0 (...)
$ ip route get 1.1.1.1 oif wlan0
1.1.1.1 via 192.168.1.1 dev wlan0 (...)
```

> would you pls help double confirm the pcap is with mptcp or without. thx

Yes, MPTCP is used: you can see `MPTCP` as protocol in the SYN, SYN+ACK, ACK and FIN. Or if you look at the TCP options being used.

**Comment by BurlyLuo** [comment]
Yes, you are rt. 
But:
```
client~$ip r get 1.1.1.1 oif net1
1.1.1.1 dev net1 src 10.1.5.10 uid 0 
    cache 
client~$ip r get 1.1.1.1 oif net2
1.1.1.1 dev net2 src 10.1.8.10 uid 0 
    cache 
client~$ip rule show 
0:      from all lookup local
32764:  from 10.1.8.10 lookup 8
32765:  from 10.1.5.10 lookup 5
32766:  from all lookup main
32767:  from all lookup default
client~$ip r s t 5
default via 10.1.5.1 dev net1 
client~$ip r s t 8
default via 10.1.8.1 dev net2 
client~$

client~$ping 1.1.1.1 -I 10.1.5.10
PING 1.1.1.1 (1.1.1.1) from 10.1.5.10 : 56(84) bytes of data.
64 bytes from 1.1.1.1: icmp_seq=1 ttl=51 time=178 ms
^C
--- 1.1.1.1 ping statistics ---
1 packets transmitted, 1 received, 0% packet loss, time 0ms
rtt min/avg/max/mdev = 177.617/177.617/177.617/0.000 ms
client~$  
```
we can see only the out-interface should not be enough. due to the ``` ip r get 1.1.1.1``` only show the outcome interface and source address., but not spec the next-hop.  
after flush the rule with ``` ip rule f```
we can see:
```
client~$ip r get 1.1.1.1 oif net1
1.1.1.1 dev net1 src 10.1.5.10 uid 0 
    cache 
client~$ping 1.1.1.1 -I 10.1.5.10
PING 1.1.1.1 (1.1.1.1) from 10.1.5.10 : 56(84) bytes of data.
^C
--- 1.1.1.1 ping statistics ---
3 packets transmitted, 0 received, 100% packet loss, time 2168ms

client~$
```
but now, 10.1.5.10 can't reach 1.1.1.1.


Another solution is set 2 default but with different priority which like:
```
ip r a default via 10.1.5.1 dev net1 metric 100

ip r a default via 10.1.8.1 dev net2 metric 200

client~$ip r get 1.1.1.1 oif net1
1.1.1.1 via 10.1.5.1 dev net1 src 10.1.5.10 uid 0 
    cache 
client~$ip r get 1.1.1.1 oif net2
1.1.1.1 via 10.1.8.1 dev net2 src 10.1.8.10 uid 0 
    cache 
client~$
```

**Comment by matttbe** [comment]
If you want to specify the output interface with `ping` you can use `-I <interface>` instead of the IP requiring the extra rules and routes:

    ping -c1 1.1.1.1 -I net1

**Comment by BurlyLuo** [comment]
It should be not. 
we need let the interface(ip address) how to get to the gw. 
```
if not spec the route, i got bellow error: 
client~$mptcpize run curl https://check.mptcp.dev/ 
curl: (6) Could not resolve host: check.mptcp.dev
client~$ip r s 
10.1.5.0/24 dev net1 proto kernel scope link src 10.1.5.10 
10.1.8.0/24 dev net2 proto kernel scope link src 10.1.8.10 
172.20.20.0/24 dev eth0 proto kernel scope link src 172.20.20.2 
client~$
```

**Comment by matttbe** [comment]
You still need a default route, to tell the kernel which way the initial subflow and all  connections not tied to one interface should go.

**Comment by BurlyLuo** [comment]
Yes, you are rt. 
and there are 2 ways to sepc the route. 
1. source based routing 
2. different metric route

thanks, thanks details the logical. @matttbe
